{
  "slug": "low-back-pain",
  "id": "low-back-pain-biomarkers",
  "condition": {
    "name": "Low Back Pain",
    "shortName": "Low Back Pain",
    "alternateNames": []
  },
  "page": {
    "title": "Low Back Pain Biomarkers: 7 Blood Tests & Lab Markers",
    "breadcrumbName": "Low Back Pain Biomarkers",
    "description": "Which blood tests and biomarkers change in Low Back Pain? 7 markers from peer-reviewed studies: direction, comparison group and source for each.",
    "keywords": [
      "Low Back Pain biomarkers",
      "Low Back Pain blood tests",
      "biomarker atlas",
      "biomarker database"
    ],
    "canonical": "https://research.opensourcemed.info/low-back-pain-biomarkers.html",
    "hero": "Molecular alterations reported in Low Back Pain compared to healthy controls, from peer-reviewed literature.",
    "dateModified": "2026-10-08"
  },
  "categories": {
    "inflammatory": "Inflammatory",
    "neurological": "Neurological",
    "other": "Other"
  },
  "filters": [
    "inflammatory",
    "neurological",
    "other"
  ],
  "markers": [
    {
      "name": "25-Hydroxyvitamin D",
      "alternateName": "25-Hydroxyvitamin D",
      "direction": "down",
      "category": "other",
      "comparison": "matched healthy controls",
      "symptoms": "chronic low back pain",
      "reference": {
        "citation": "Lotfi et al. 2007",
        "doi": "10.1007/s10067-007-0603-4"
      }
    },
    {
      "name": "Brain-Derived Neurotrophic Factor (BDNF)",
      "alternateName": "Brain-Derived Neurotrophic Factor (BDNF)",
      "direction": "mixed",
      "category": "neurological",
      "comparison": "pain-free controls",
      "symptoms": "after an acute episode of low back pain",
      "reference": {
        "citation": "Diz et al. 2017",
        "doi": "10.1016/j.archger.2017.03.005"
      }
    },
    {
      "name": "CRP",
      "alternateName": "CRP",
      "direction": "up",
      "category": "inflammatory",
      "comparison": "nonspecific LBP vs healthy (association evidence)",
      "symptoms": "",
      "reference": {
        "citation": "Lim et al. 2020",
        "doi": "10.1097/AJP.0000000000000810"
      },
      "testType": "BloodTest",
      "loinc": "1988-5"
    },
    {
      "name": "IL-6",
      "alternateName": "IL-6",
      "direction": "up",
      "category": "inflammatory",
      "comparison": "chronic nonspecific LBP vs asymptomatic controls",
      "symptoms": "",
      "reference": {
        "citation": "Injeyan et al. 2025",
        "doi": "10.1177/11772719251355038"
      },
      "testType": "BloodTest",
      "loinc": "26881-3"
    },
    {
      "name": "Interleukin-1 beta",
      "alternateName": "Interleukin-1 beta",
      "direction": "up",
      "category": "other",
      "comparison": "control discs",
      "symptoms": "",
      "reference": {
        "citation": "Kang et al. 1996",
        "doi": "10.1097/00007632-199602010-00003"
      }
    },
    {
      "name": "Substance P",
      "alternateName": "Substance P",
      "direction": "mixed",
      "category": "other",
      "comparison": "patients with non-damaged CEPs",
      "symptoms": "low back pain and disability",
      "reference": {
        "citation": "Huang et al. 2021",
        "doi": "10.1111/joa.13321"
      }
    },
    {
      "name": "TNF-alpha",
      "alternateName": "TNF-alpha",
      "direction": "up",
      "category": "inflammatory",
      "comparison": "patients without micro-damaged CEPs",
      "symptoms": "low back pain and disability",
      "reference": {
        "citation": "Huang et al. 2021",
        "doi": "10.1111/joa.13321"
      }
    }
  ]
}